{
  "eventId": "90000013-0000-4000-8000-000000000001",
  "eventType": "PolicyExpired",
  "eventVersion": 1,
  "occurredAt": "2026-09-27T10:00:00Z",
  "aggregateId": "44444444-4444-4444-8444-444444444444",
  "aggregateVersion": 3,
  "correlationId": "ejemplo-contrato",
  "producer": "policy-service",
  "data": {
    "policyId": "44444444-4444-4444-8444-444444444444",
    "customerId": "11111111-1111-4111-8111-111111111111",
    "reason": "Fin de vigencia"
  }
}
